{
  "schema_version": "0.1.0-draft",
  "plan_id": "123e4567-e89b-42d3-a456-426614174010",
  "task_id": "123e4567-e89b-42d3-a456-426614174000",
  "created_at": "2026-10-31T00:00:01Z",
  "steps": [
    {
      "step_id": "123e4567-e89b-42d3-a456-426614174011",
      "sequence": 1,
      "operation_id": "system.storage.get_usage",
      "input": {
        "mount_point": "/"
      },
      "depends_on": [],
      "preconditions": [],
      "expected_postconditions": [
        { "description": "Return current capacity observation" }
      ],
      "risk_hint": "read_only",
      "timeout_ms": 10000,
      "idempotency_key": null,
      "state": "pending"
    }
  ],
  "requires_confirmation": false
}
